{
  "recommended_tier": "regional_edge",
  "scores": {
    "on_device": 85,
    "far_edge": 75,
    "regional_edge": 92,
    "cloud": 60
  },
  "estimates": {
    "latency_ms": 25,
    "monthly_cost": 800,
    "currency": "INR"
  },
  "explanation": "Regional edge provides a good balance of latency, bandwidth, cost, privacy, and criticality requirements.",
  "tradeoffs": [
    "Higher cost than on-device deployment",
    "Requires edge infrastructure"
  ],
  "warnings": [],
  "assumptions": [
    "Latency and cost are estimates based on workload requirements and infrastructure assumptions."
  ],
  "architecture": {
    "nodes": [
      {"id": "device", "label": "User Device", "type": "device"},
      {"id": "edge", "label": "Regional Edge", "type": "edge"},
      {"id": "cloud", "label": "Cloud Server", "type": "cloud"}
    ],
    "connections": [
      {"source": "device", "target": "edge"},
      {"source": "edge", "target": "cloud"}
    ]
  }
}
